{
  "baselineId": "k8s-cis-1.11",
  "title": "CIS Kubernetes Benchmark v1.11 aligned baseline",
  "cloud": "K8s",
  "version": "2026.2",
  "description": "Threshold values consumed by CSAF Kubernetes check functions. Customer baselines may override any key.",
  "thresholds": {},
  "severityOverrides": {},
  "notApplicableControls": []
}
