{
  "baselineId": "azure-cis-6.0",
  "title": "CIS Microsoft Azure Foundations Benchmark v6.0 aligned baseline",
  "cloud": "Azure",
  "version": "2026.2",
  "description": "Threshold values consumed by CSAF Azure check functions. Customer baselines may override any key.",
  "thresholds": {
    "sensitiveIngressPorts": [
      22,
      3389
    ],
    "subscriptionOwnerMaxCount": 3,
    "requiredDefenderPlans": [
      "VirtualMachines",
      "StorageAccounts",
      "SqlServers"
    ]
  },
  "severityOverrides": {},
  "notApplicableControls": []
}
