{
  "baselineId": "gcp-cis-1.3",
  "title": "CIS Google Cloud Platform Foundations Benchmark v1.3 aligned baseline",
  "cloud": "GCP",
  "version": "2026.1",
  "description": "Threshold values consumed by CSAF GCP check functions. Customer baselines may override any key.",
  "thresholds": {
    "sensitiveIngressPorts": [22, 3389],
    "saKeyMaxAgeDays": 90,
    "kmsRotationMaxDays": 90
  },
  "severityOverrides": {},
  "notApplicableControls": []
}
