{
  "baselineId": "aws-cis-5.0",
  "title": "AWS CIS Foundations Benchmark v5.0 aligned baseline",
  "cloud": "AWS",
  "version": "2026.2",
  "description": "Threshold values consumed by CSAF check functions. Customer baselines may override any key.",
  "thresholds": {
    "passwordMinLength": 14,
    "passwordRequireSymbols": true,
    "passwordRequireNumbers": true,
    "passwordRequireUppercase": true,
    "passwordRequireLowercase": true,
    "passwordMaxAgeDays": 90,
    "passwordReusePrevention": 24,
    "accessKeyMaxAgeDays": 90,
    "credentialInactivityDays": 90,
    "rootActivityThresholdDays": 30,
    "sensitiveIngressPorts": [
      22,
      3389
    ],
    "requireImdsV2": true,
    "requireEbsDefaultEncryption": true,
    "requireMultiRegionCloudTrail": true,
    "requireGuardDuty": true,
    "requireConfig": true,
    "requireKmsKeyRotation": true
  },
  "severityOverrides": {},
  "notApplicableControls": []
}
